{"status": "ok", "updated_at": "2026-10-20T21:29:16.142252+00:00", "market_open": false, "quote_as_of": "2026-10-20T21:28:59+00:00", "spot": 771.2, "expiry": "2026-10-20", "n_strikes": 146, "n_strikes_rtd_live": 3, "n_strikes_nasdaq_delayed": 143, "sources": {"rtd": {"as_of": "2026-10-20T21:28:59+00:00", "delay": "realtime", "n_strikes": 3}, "nasdaq": {"as_of": "2026-10-20T21:29:31.443624+00:00", "delay": "~15min", "n_strikes": 143, "stale": false}}, "gamma": {"spot": 771.2, "expiry": "2026-10-20", "gex_formula": "v2", "gex_units": "USD millions per 1% spot move", "net_gex_m": 2853.14, "gamma_flip": 766.58, "gamma_flip_method": "spot_root_frozen_iv_oi", "gamma_flip_roots": [766.58], "gamma_flip_residuals": [0.0], "gamma_flip_scale": 6163155.6005209545, "gamma_flip_underflow_samples": 384, "speed_m_per_pt2": -92.5, "speed_wide_m_per_pt2": 94.4, "speed_note": "change in dealer gamma ($M/pt) per $1 of spot travel, frozen-IV/OI scenario; magnitude = cliff steepness at spot", "gamma_flip_note": null, "call_wall": 770.0, "put_wall": null, "regime": "positive-gamma (pinning)", "by_strike": [{"strike": 550.0, "src": "nasdaq_delayed", "greeks": "modeled_atm_iv", "net_gex_m": 0.0, "call_gex_m": 0.0, "put_gex_m": -0.0}, {"strike": 555.0, "src": "nasdaq_delayed", "greeks": "modeled_atm_iv", "net_gex_m": 0.0, "call_gex_m": 0.0, "put_gex_m": -0.0}, {"strike": 560.0, "src": "nasdaq_delayed", "greeks": "modeled_atm_iv", "net_gex_m": 0.0, "call_gex_m": 0.0, "put_gex_m": -0.0}, {"strike": 565.0, "src": "nasdaq_delayed", "greeks": "modeled_atm_iv", "net_gex_m": 0.0, "call_gex_m": 0.0, "put_gex_m": -0.0}, {"strike": 570.0, "src": "nasdaq_delayed", "greeks": "modeled_atm_iv", "net_gex_m": 0.0, "call_gex_m": 0.0, "put_gex_m": -0.0}, {"strike": 575.0, "src": "nasdaq_delayed", "greeks": "modeled_atm_iv", "net_gex_m": 0.0, "call_gex_m": 0.0, "put_gex_m": -0.0}, {"strike": 580.0, "src": "nasdaq_delayed", "greeks": "modeled_atm_iv", "net_gex_m": 0.0, "call_gex_m": 0.0, "put_gex_m": -0.0}, {"strike": 585.0, "src": "nasdaq_delayed", "greeks": "modeled_atm_iv", "net_gex_m": 0.0, "call_gex_m": 0.0, "put_gex_m": -0.0}, {"strike": 590.0, "src": "nasdaq_delayed", "greeks": "modeled_atm_iv", "net_gex_m": 0.0, "call_gex_m": 0.0, "put_gex_m": -0.0}, {"strike": 595.0, "src": "nasdaq_delayed", "greeks": "modeled_atm_iv", "net_gex_m": 0.0, "call_gex_m": 0.0, "put_gex_m": -0.0}, {"strike": 600.0, "src": "nasdaq_delayed", "greeks": "modeled_atm_iv", "net_gex_m": 0.0, "call_gex_m": 0.0, "put_gex_m": -0.0}, {"strike": 605.0, "src": "nasdaq_delayed", "greeks": "modeled_atm_iv", "net_gex_m": 0.0, "call_gex_m": 0.0, "put_gex_m": -0.0}, {"strike": 610.0, "src": "nasdaq_delayed", "greeks": "modeled_atm_iv", "net_gex_m": 0.0, "call_gex_m": 0.0, "put_gex_m": -0.0}, {"strike": 615.0, "src": "nasdaq_delayed", "greeks": "modeled_atm_iv", "net_gex_m": 0.0, "call_gex_m": 0.0, "put_gex_m": -0.0}, {"strike": 620.0, "src": "nasdaq_delayed", "greeks": "modeled_atm_iv", "net_gex_m": 0.0, "call_gex_m": 0.0, "put_gex_m": -0.0}, {"strike": 625.0, "src": "nasdaq_delayed", "greeks": "modeled_atm_iv", "net_gex_m": 0.0, "call_gex_m": 0.0, "put_gex_m": -0.0}, {"strike": 630.0, "src": "nasdaq_delayed", "greeks": "modeled_atm_iv", "net_gex_m": 0.0, "call_gex_m": 0.0, "put_gex_m": -0.0}, {"strike": 635.0, "src": "nasdaq_delayed", "greeks": "modeled_atm_iv", "net_gex_m": 0.0, "call_gex_m": 0.0, "put_gex_m": -0.0}, {"strike": 640.0, "src": "nasdaq_delayed", "greeks": "modeled_atm_iv", "net_gex_m": 0.0, "call_gex_m": 0.0, "put_gex_m": -0.0}, {"strike": 645.0, "src": "nasdaq_delayed", "greeks": "modeled_atm_iv", "net_gex_m": 0.0, "call_gex_m": 0.0, "put_gex_m": -0.0}, {"strike": 650.0, "src": "nasdaq_delayed", "greeks": "modeled_atm_iv", "net_gex_m": 0.0, "call_gex_m": 0.0, "put_gex_m": -0.0}, {"strike": 655.0, "src": "nasdaq_delayed", "greeks": "modeled_atm_iv", "net_gex_m": 0.0, "call_gex_m": 0.0, "put_gex_m": -0.0}, {"strike": 660.0, "src": "nasdaq_delayed", "greeks": "modeled_atm_iv", "net_gex_m": 0.0, "call_gex_m": 0.0, "put_gex_m": -0.0}, {"strike": 665.0, "src": "nasdaq_delayed", "greeks": "modeled_atm_iv", "net_gex_m": 0.0, "call_gex_m": 0.0, "put_gex_m": -0.0}, {"strike": 670.0, "src": "nasdaq_delayed", "greeks": "modeled_atm_iv", "net_gex_m": 0.0, "call_gex_m": 0.0, "put_gex_m": -0.0}, {"strike": 675.0, "src": "nasdaq_delayed", "greeks": "modeled_atm_iv", "net_gex_m": 0.0, "call_gex_m": 0.0, "put_gex_m": -0.0}, {"strike": 680.0, "src": "nasdaq_delayed", "greeks": "modeled_atm_iv", "net_gex_m": 0.0, "call_gex_m": 0.0, "put_gex_m": -0.0}, {"strike": 685.0, "src": "nasdaq_delayed", "greeks": "modeled_atm_iv", "net_gex_m": 0.0, "call_gex_m": 0.0, "put_gex_m": -0.0}, {"strike": 690.0, "src": "nasdaq_delayed", "greeks": "modeled_atm_iv", "net_gex_m": 0.0, "call_gex_m": 0.0, "put_gex_m": -0.0}, {"strike": 695.0, "src": "nasdaq_delayed", "greeks": "modeled_atm_iv", "net_gex_m": 0.0, "call_gex_m": 0.0, "put_gex_m": -0.0}, {"strike": 700.0, "src": "nasdaq_delayed", "greeks": "modeled_atm_iv", "net_gex_m": 0.0, "call_gex_m": 0.0, "put_gex_m": -0.0}, {"strike": 705.0, "src": "nasdaq_delayed", "greeks": "modeled_atm_iv", "net_gex_m": 0.0, "call_gex_m": 0.0, "put_gex_m": -0.0}, {"strike": 710.0, "src": "nasdaq_delayed", "greeks": "modeled_atm_iv", "net_gex_m": 0.0, "call_gex_m": 0.0, "put_gex_m": -0.0}, {"strike": 715.0, "src": "nasdaq_delayed", "greeks": "modeled_atm_iv", "net_gex_m": 0.0, "call_gex_m": 0.0, "put_gex_m": -0.0}, {"strike": 720.0, "src": "nasdaq_delayed", "greeks": "modeled_atm_iv", "net_gex_m": 0.0, "call_gex_m": 0.0, "put_gex_m": -0.0}, {"strike": 725.0, "src": "nasdaq_delayed", "greeks": "modeled_atm_iv", "net_gex_m": 0.0, "call_gex_m": 0.0, "put_gex_m": -0.0}, {"strike": 729.0, "src": "nasdaq_delayed", "greeks": "modeled_atm_iv", "net_gex_m": 0.0, "call_gex_m": 0.0, "put_gex_m": -0.0}, {"strike": 730.0, "src": "nasdaq_delayed", "greeks": "modeled_atm_iv", "net_gex_m": 0.0, "call_gex_m": 0.0, "put_gex_m": -0.0}, {"strike": 731.0, "src": "nasdaq_delayed", "greeks": "modeled_atm_iv", "net_gex_m": 0.0, "call_gex_m": 0.0, "put_gex_m": -0.0}, {"strike": 732.0, "src": "nasdaq_delayed", "greeks": "modeled_atm_iv", "net_gex_m": 0.0, "call_gex_m": 0.0, "put_gex_m": -0.0}, {"strike": 733.0, "src": "nasdaq_delayed", "greeks": "modeled_atm_iv", "net_gex_m": 0.0, "call_gex_m": 0.0, "put_gex_m": -0.0}, {"strike": 734.0, "src": "nasdaq_delayed", "greeks": "modeled_atm_iv", "net_gex_m": 0.0, "call_gex_m": 0.0, "put_gex_m": -0.0}, {"strike": 735.0, "src": "nasdaq_delayed", "greeks": "modeled_atm_iv", "net_gex_m": 0.0, "call_gex_m": 0.0, "put_gex_m": -0.0}, {"strike": 736.0, "src": "nasdaq_delayed", "greeks": "modeled_atm_iv", "net_gex_m": 0.0, "call_gex_m": 0.0, "put_gex_m": -0.0}, {"strike": 737.0, "src": "nasdaq_delayed", "greeks": "modeled_atm_iv", "net_gex_m": 0.0, "call_gex_m": 0.0, "put_gex_m": -0.0}, {"strike": 738.0, "src": "nasdaq_delayed", "greeks": "modeled_atm_iv", "net_gex_m": 0.0, "call_gex_m": 0.0, "put_gex_m": -0.0}, {"strike": 739.0, "src": "nasdaq_delayed", "greeks": "modeled_atm_iv", "net_gex_m": 0.0, "call_gex_m": 0.0, "put_gex_m": -0.0}, {"strike": 740.0, "src": "nasdaq_delayed", "greeks": "modeled_atm_iv", "net_gex_m": 0.0, "call_gex_m": 0.0, "put_gex_m": -0.0}, {"strike": 741.0, "src": "nasdaq_delayed", "greeks": "modeled_atm_iv", "net_gex_m": 0.0, "call_gex_m": 0.0, "put_gex_m": -0.0}, {"strike": 742.0, "src": "nasdaq_delayed", "greeks": "modeled_atm_iv", "net_gex_m": 0.0, "call_gex_m": 0.0, "put_gex_m": -0.0}, {"strike": 743.0, "src": "nasdaq_delayed", "greeks": "modeled_atm_iv", "net_gex_m": 0.0, "call_gex_m": 0.0, "put_gex_m": -0.0}, {"strike": 744.0, "src": "nasdaq_delayed", "greeks": "modeled_atm_iv", "net_gex_m": 0.0, "call_gex_m": 0.0, "put_gex_m": -0.0}, {"strike": 745.0, "src": "nasdaq_delayed", "greeks": "modeled_atm_iv", "net_gex_m": 0.0, "call_gex_m": 0.0, "put_gex_m": -0.0}, {"strike": 746.0, "src": "nasdaq_delayed", "greeks": "modeled_atm_iv", "net_gex_m": 0.0, "call_gex_m": 0.0, "put_gex_m": -0.0}, {"strike": 747.0, "src": "nasdaq_delayed", "greeks": "modeled_atm_iv", "net_gex_m": 0.0, "call_gex_m": 0.0, "put_gex_m": -0.0}, {"strike": 748.0, "src": "nasdaq_delayed", "greeks": "modeled_atm_iv", "net_gex_m": 0.0, "call_gex_m": 0.0, "put_gex_m": -0.0}, {"strike": 749.0, "src": "nasdaq_delayed", "greeks": "modeled_atm_iv", "net_gex_m": 0.0, "call_gex_m": 0.0, "put_gex_m": -0.0}, {"strike": 750.0, "src": "nasdaq_delayed", "greeks": "modeled_atm_iv", "net_gex_m": 0.0, "call_gex_m": 0.0, "put_gex_m": -0.0}, {"strike": 751.0, "src": "nasdaq_delayed", "greeks": "modeled_atm_iv", "net_gex_m": 0.0, "call_gex_m": 0.0, "put_gex_m": -0.0}, {"strike": 752.0, "src": "nasdaq_delayed", "greeks": "modeled_atm_iv", "net_gex_m": 0.0, "call_gex_m": 0.0, "put_gex_m": -0.0}, {"strike": 753.0, "src": "nasdaq_delayed", "greeks": "modeled_atm_iv", "net_gex_m": 0.0, "call_gex_m": 0.0, "put_gex_m": -0.0}, {"strike": 754.0, "src": "nasdaq_delayed", "greeks": "modeled_atm_iv", "net_gex_m": 0.0, "call_gex_m": 0.0, "put_gex_m": -0.0}, {"strike": 755.0, "src": "nasdaq_delayed", "greeks": "modeled_atm_iv", "net_gex_m": 0.0, "call_gex_m": 0.0, "put_gex_m": -0.0}, {"strike": 756.0, "src": "nasdaq_delayed", "greeks": "modeled_atm_iv", "net_gex_m": 0.0, "call_gex_m": 0.0, "put_gex_m": -0.0}, {"strike": 757.0, "src": "nasdaq_delayed", "greeks": "modeled_atm_iv", "net_gex_m": 0.0, "call_gex_m": 0.0, "put_gex_m": -0.0}, {"strike": 758.0, "src": "nasdaq_delayed", "greeks": "modeled_atm_iv", "net_gex_m": 0.0, "call_gex_m": 0.0, "put_gex_m": -0.0}, {"strike": 759.0, "src": "nasdaq_delayed", "greeks": "modeled_atm_iv", "net_gex_m": 0.0, "call_gex_m": 0.0, "put_gex_m": -0.0}, {"strike": 760.0, "src": "nasdaq_delayed", "greeks": "modeled_atm_iv", "net_gex_m": 0.0, "call_gex_m": 0.0, "put_gex_m": -0.0}, {"strike": 761.0, "src": "nasdaq_delayed", "greeks": "modeled_atm_iv", "net_gex_m": 0.0, "call_gex_m": 0.0, "put_gex_m": -0.0}, {"strike": 762.0, "src": "nasdaq_delayed", "greeks": "modeled_atm_i